{
  "kind": "mdbase.testbed.scenario",
  "protocol_version": "0.1",
  "id": "core.shared-type-contracts",
  "name": "One type exposes two independent contract views",
  "description": "One local type implements two record contracts and each consumer observes only the normalized view it selected.",
  "ring": "contract",
  "profile": "data_contracts",
  "roles": ["contract_store", "record_consumer"],
  "operation": "contract.multiple-views",
  "fixtures": [
    "contract.example-note",
    "contract.example-summary",
    "type.multi-contract-note",
    "record.shared-note"
  ],
  "parameters": {
    "consumers": ["note-consumer", "summary-consumer"]
  },
  "covers": [
    "data_contracts.data_contract_discovery",
    "data_contracts.data_contract_implementation_validation",
    "data_contracts.data_contract_projection"
  ],
  "expect": {
    "entries": [
      {
        "sequence": 1,
        "phase": "arrange",
        "actor": "contract-store",
        "operation": "contract.load",
        "outcome": "succeeded",
        "facts": {
          "contracts": ["example.note", "example.summary"]
        }
      },
      {
        "sequence": 2,
        "phase": "arrange",
        "actor": "contract-store",
        "operation": "type.load",
        "outcome": "succeeded",
        "facts": {
          "type": "shared_note",
          "implements": ["example.note", "example.summary"]
        }
      },
      {
        "sequence": 3,
        "phase": "act",
        "actor": "note-consumer",
        "operation": "contract-view.read",
        "outcome": "succeeded",
        "facts": {
          "contract": "example.note",
          "view": {
            "title": "One record, two consumers"
          }
        }
      },
      {
        "sequence": 4,
        "phase": "act",
        "actor": "summary-consumer",
        "operation": "contract-view.read",
        "outcome": "succeeded",
        "facts": {
          "contract": "example.summary",
          "view": {
            "label": "One record, two consumers"
          }
        }
      },
      {
        "sequence": 5,
        "phase": "observe",
        "actor": "testbed",
        "operation": "contract-view.compare",
        "outcome": "succeeded",
        "facts": {
          "same_record": true,
          "views_are_distinct": true
        }
      }
    ]
  }
}
